{
  "request_id": "req-1",
  "model_id": "whisper-stt",
  "bindings": {
    "audio": "microphone-ab12"
  },
  "policy": {
    "allowed": [
      "local",
      "trusted_edge"
    ],
    "preferred": [
      "trusted_edge"
    ],
    "max_latency_ms": 5000,
    "max_cost": null,
    "queue_if_unavailable": false,
    "privacy": {}
  },
  "source_device": "pi1",
  "target": null,
  "window_seconds": 4.0,
  "config": {}
}
